{
  "schema_version": "1.0.0",
  "run_id": "run_2026-03-19T05:00:00-04:00_abc123",
  "analysis_date": "2026-03-19",
  "data_window": {
    "start": "2026-03-18T05:00:00-04:00",
    "end": "2026-03-19T05:00:00-04:00"
  },
  "source_coverage": 82,
  "overall_assessment": {
    "overall_score": 74,
    "health_band": "Healthy",
    "prior_day_score": 71,
    "seven_day_trend_delta": 3,
    "thirty_day_trend_delta": -2,
    "trend_direction": "Improving",
    "confidence": 78,
    "evidence_count": 6,
    "executive_readout": "Political health is Healthy with modest improvement; sponsor confidence held while one Tier 1 peer needs a clarifying follow-up on ownership.",
    "what_changed": "Peer alignment on roadmap sequencing improved after yesterday's working session. A delivery commitment date slipped without a shared narrative, creating a watch item.",
    "key_wins": "Sponsor reiterated support for the Q2 scope in the 1:1. Cross-functional peer offered to co-own the dependency checklist.",
    "key_risks": "Ambiguous ownership on the platform migration workstream with a Tier 1 peer; risk of silent expectation mismatch.",
    "top_actions": "1) Schedule a 20-min clarifying 1:1 on migration ownership. 2) Send a concise status note to sponsor. 3) Validate the slipped date narrative with delivery lead.",
    "signals_to_verify": "Unverified: peer comment that 'leadership may revisit scope' — corroborate before treating as a decision signal."
  },
  "people": [
    {
      "external_key": "person:jordan-lee",
      "name": "Jordan Lee",
      "organization_function": "Product",
      "role_title": "VP Product",
      "relationship_type": ["Executive Sponsor"],
      "strategic_tier": "Tier 1",
      "influence_level": 5,
      "decision_proximity": 5,
      "relationship_objective": "Maintain clear sponsorship and early visibility on tradeoffs.",
      "do_not_infer": "Do not infer personal motives or private preferences from meeting tone."
    },
    {
      "external_key": "person:sam-okonkwo",
      "name": "Sam Okonkwo",
      "organization_function": "Engineering",
      "role_title": "Director of Platform",
      "relationship_type": ["Peer", "Key Partner"],
      "strategic_tier": "Tier 1",
      "influence_level": 4,
      "decision_proximity": 4
    },
    {
      "external_key": "person:riley-chen",
      "name": "Riley Chen",
      "organization_function": "Delivery",
      "role_title": "Program Lead",
      "relationship_type": ["Peer"],
      "strategic_tier": "Tier 2",
      "influence_level": 3,
      "decision_proximity": 3
    }
  ],
  "dimension_scores": [
    {
      "external_key": "dimension:sponsor-confidence:2026-03-19",
      "dimension": "Sponsor confidence",
      "weight": 0.2,
      "score": 84,
      "delta_vs_prior_day": 2,
      "trend": "Improving",
      "confidence": 80,
      "evidence_summary": "Sponsor affirmed Q2 scope support in 1:1.",
      "what_drove_change": "Direct affirmation + request for earlier escalation on tradeoffs.",
      "recommended_action": "Send brief weekly pulse note.",
      "evidence_external_keys": ["evidence:ev-001"]
    },
    {
      "external_key": "dimension:stakeholder-alignment:2026-03-19",
      "dimension": "Stakeholder alignment",
      "weight": 0.18,
      "score": 68,
      "delta_vs_prior_day": -4,
      "trend": "Declining",
      "confidence": 72,
      "evidence_summary": "Ownership ambiguity on migration workstream.",
      "what_drove_change": "Peer exchange left decision rights unclear.",
      "recommended_action": "Clarify RACI in a short written follow-up.",
      "evidence_external_keys": ["evidence:ev-002", "evidence:ev-003"]
    },
    {
      "external_key": "dimension:delivery-credibility:2026-03-19",
      "dimension": "Delivery credibility",
      "weight": 0.15,
      "score": 70,
      "delta_vs_prior_day": 0,
      "trend": "Stable",
      "confidence": 75,
      "evidence_summary": "Date slip disclosed; narrative not yet shared broadly.",
      "what_drove_change": "Commitment change without synchronized messaging.",
      "recommended_action": "Align on shared status language before next forum.",
      "evidence_external_keys": ["evidence:ev-004"]
    }
  ],
  "relationship_assessments": [
    {
      "external_key": "relationship-assessment:person:jordan-lee:2026-03-19",
      "person_external_key": "person:jordan-lee",
      "daily_score": 86,
      "score_delta": 2,
      "trend": "Improving",
      "confidence": 82,
      "engagement_quality": 88,
      "trust_credibility": 85,
      "alignment": 84,
      "influence_sponsorship": 90,
      "responsiveness_reciprocity": 80,
      "risk_level": "Low",
      "readout": "Sponsor relationship remains Strong with clear support for Q2 scope.",
      "positive_signals": "Explicit support; asked for earlier escalation on tradeoffs.",
      "watch_outs": "None material today.",
      "recommended_next_move": "Send a concise weekly pulse covering tradeoffs and asks.",
      "evidence_external_keys": ["evidence:ev-001"],
      "action_external_keys": ["action:act-002"]
    },
    {
      "external_key": "relationship-assessment:person:sam-okonkwo:2026-03-19",
      "person_external_key": "person:sam-okonkwo",
      "daily_score": 58,
      "score_delta": -6,
      "trend": "Declining",
      "confidence": 70,
      "engagement_quality": 60,
      "trust_credibility": 62,
      "alignment": 52,
      "influence_sponsorship": 55,
      "responsiveness_reciprocity": 58,
      "risk_level": "High",
      "readout": "Tier 1 peer alignment dipped on migration ownership clarity.",
      "positive_signals": "Peer still engaged and willing to meet.",
      "watch_outs": "Ambiguous decision rights; potential expectation mismatch.",
      "recommended_next_move": "Schedule a clarifying 1:1 focused only on ownership and interfaces.",
      "evidence_external_keys": ["evidence:ev-002", "evidence:ev-003"],
      "action_external_keys": ["action:act-001"]
    }
  ],
  "interactions": [
    {
      "external_key": "limitless:mtg-77821",
      "title": "1:1 with Jordan Lee",
      "interaction_datetime": "2026-03-18T15:30:00-04:00",
      "source_system": "Limitless",
      "source_reference": "https://secure.example/limitless/mtg-77821",
      "interaction_type": "One-to-One",
      "participant_external_keys": ["person:jordan-lee"],
      "topics": ["Strategy", "Delivery"],
      "organizational_relevance": "High",
      "summary": "Discussed Q2 scope support and preference for earlier tradeoff escalation.",
      "key_decisions": "Keep Q2 scope; escalate tradeoffs earlier.",
      "commitments": "Executive to send weekly pulse note.",
      "sentiment_tone": "Constructive",
      "evidence_quality": "Direct",
      "raw_content_location": "https://secure.example/limitless/mtg-77821",
      "included_in_analysis": true
    },
    {
      "external_key": "plaud:rec-44102",
      "title": "Platform migration sync",
      "interaction_datetime": "2026-03-18T11:00:00-04:00",
      "source_system": "Plaud",
      "source_reference": "https://secure.example/plaud/rec-44102",
      "interaction_type": "Meeting",
      "participant_external_keys": ["person:sam-okonkwo", "person:riley-chen"],
      "topics": ["Delivery", "Operations"],
      "organizational_relevance": "Critical",
      "summary": "Migration ownership and interface boundaries remained unresolved.",
      "key_decisions": "None finalized.",
      "commitments": "Follow-up 1:1 to clarify RACI.",
      "sentiment_tone": "Mixed",
      "evidence_quality": "Direct",
      "raw_content_location": "https://secure.example/plaud/rec-44102",
      "included_in_analysis": true
    },
    {
      "external_key": "email:thread-99012",
      "title": "Delivery date update thread",
      "interaction_datetime": "2026-03-18T17:05:00-04:00",
      "source_system": "Email",
      "source_reference": "https://secure.example/mail/thread-99012",
      "interaction_type": "Email Thread",
      "participant_external_keys": ["person:riley-chen"],
      "topics": ["Delivery"],
      "organizational_relevance": "High",
      "summary": "Program lead disclosed a commitment date slip; shared narrative not yet drafted.",
      "key_decisions": "Date moved; messaging pending.",
      "commitments": "Align status language before next forum.",
      "sentiment_tone": "Neutral",
      "evidence_quality": "Direct",
      "raw_content_location": "https://secure.example/mail/thread-99012",
      "included_in_analysis": true
    }
  ],
  "evidence": [
    {
      "external_key": "evidence:ev-001",
      "title": "Evidence — 2026-03-18 — sponsor Q2 support",
      "event_datetime": "2026-03-18T15:40:00-04:00",
      "source_system": "Limitless",
      "source_reference": "https://secure.example/limitless/mtg-77821#t=600",
      "interaction_external_key": "limitless:mtg-77821",
      "related_people_external_keys": ["person:jordan-lee"],
      "claim_type": "Sponsor Signal",
      "redacted_evidence_snippet": "Jordan: \"I'm still behind the Q2 scope. Flag tradeoffs earlier so we can choose deliberately.\"",
      "analyst_interpretation": "Direct sponsor confidence signal with an engagement preference for earlier escalation.",
      "confidence": 90,
      "verification_status": "Corroborated",
      "sensitive_content_flag": false
    },
    {
      "external_key": "evidence:ev-002",
      "title": "Evidence — 2026-03-18 — ownership ambiguity",
      "event_datetime": "2026-03-18T11:20:00-04:00",
      "source_system": "Plaud",
      "source_reference": "https://secure.example/plaud/rec-44102#t=1200",
      "interaction_external_key": "plaud:rec-44102",
      "related_people_external_keys": ["person:sam-okonkwo"],
      "claim_type": "Alignment Signal",
      "redacted_evidence_snippet": "Sam: \"I thought your team owned the cutover checklist; we can take interfaces if that's clearer.\"",